filename,date,keyword,count,context
cn1938-11-16.txt,1938-11-16,negro or negroes,1,"that has built all of this,” declared Mr. Green. “America can boast no great, musicians except.the negro and no really brilliant painters and sculptors. Poetry and the thea-  tre must be the home of"
cn1938-12-14.txt,1938-12-14,negro or negroes,1,as less race  consciousness than Page Scho It is obvious that our racia ems in dealing with a large negro popu- lation and a large population of Orien- tal peoples on the Pacific Coast are of the utmo
cn1939-03-08.txt,1939-03-08,negro or negroes,3,"FIRST: onditions of the maids on campus. There has been improvement :in their wages and housing. Since the negro race has never had much leisure time and now has more, it is important that they be taught how
LAST: ting on Mrs. Roose- velt’s protest against the refusal of the D.A.R. to permit the talented        ‘Negro contralto, Marion Anderson, to  sing in Constitution Hall. The rum- pus was caused ‘én the pri "
cn1939-03-22.txt,1939-03-22,negro or negroes,3,"FIRST: e of the most impressive, groups that they did. The rhythm of these dances appeals naturally to the Negro race, and with an added dig-  realistically convincing on the stage. In the first scene the ki
LAST: ng that forms the foundation of this piecé had the repetitive quality of  phases of the life of the negro in|, ,imitive chants.  America: the primitive spirit ~ ofthe’ race before slavery, the toil of "
cn1939-04-12.txt,1939-04-12,negro or negroes,1,"ughlin, and of the World’s Fair Administra- tion, which has debarred Jews and em- ployed only a few Negroes.  III. We support the Good Neigh- bor Policy of the present administra- tion and urge cooper"
cn1939-04-19.txt,1939-04-19,negro or negroes,1,"collega students from all parts of the coyntry, young workers from trade unions, representatives of negro youth organizations, and _re- cently arrived refugees, most of whom will be from Central, Eyxo"
cn1939-04-26.txt,1939-04-26,negro or negroes,2,"FIRST:  own collection, American Songbag, and from Mr, Lo- max’s American Songs and Ballads. They included negro spirituals, pio- neer and cowboy i, rea one brief but pointed ditty hear  cleaning woman:  “Gr
LAST: ay assume—the——  of discovering truth, but deals with  habit,” Mr. Sandburg chanted several —  om a negro  If they wished to be -.. ‘amused, they found agreeable diver--—  As he dipaietad ree the diae "
cn1939-05-10.txt,1939-05-10,negro or negroes,1,"s over whom he pre-  -~pided. As a specific; if minor, illus-  tration, Mr. Lewis’ dismissal of the negro porter, with the words “nice fellow,” . seemed patronizing rather than sincere. ‘Comparison wi"
cn1939-10-18.txt,1939-10-18,negro or negroes,1,"war and of peace, with our ideals of individual liberty unconquered.    criminals,-and— picnicking negroes! Spain, the circus business and the fishing industry all with the same understanding. y    ."
cn1939-11-01.txt,1939-11-01,negro or negroes,7,"FIRST: mance an unusual emotional appeal.  The scenes illustrating the strug- gle for free public schools, negro and workers’ education, were all varied and entertaining, especially when Kristi Putnam raced 
LAST:  “W. P. A. appropriations have been cut,” “My state spends twice as much for white education as for negro education,” and “They’ve given our money to the Dies Committee.” Although this scene was not s "
cn1939-11-29.txt,1939-11-29,negro or negroes,3,"FIRST:  it. They accept | bribes,” said ‘ one wprker,  Another problem is that of dis- crimination against Negroes. As a general. rule, the projects are ar-  ranged for. either Negroes or white people, but i
LAST: Philadelphia they are trying.te mix the, two groups. In Wayne, the rule is fixed for 50 per _ cant, Negro. and 50 per. cent white. Considering the many obstacles,  =r  eS ee  The|    Miss Fairchild  M "
cn1939-12-06.txt,1939-12-06,negro or negroes,1,"ked quickly.  “No,” said /Lacy. week.”  Deciding not to quibble, we went on to the /question of the Negro vote. “You can’t depend on them,” he said.  “Buy ’em out?” we ventured. He nodded his head.  “"
cn1939-12-20.txt,1939-12-20,negro or negroes,3,"FIRST: icasso’s ear- lier work. He later returned to it after excursions into the simplifi- seation of the Negro period, and into various types of cubism, sur- realism and classicism.  Following the Rose Per
LAST: t  | are sent by Social Service agents.| * : this Eastern conflict and the pres-  Sixty per cent ar negro, most are on relief. They are charged from 10 to 25 cents a visite”Many are treated as out-pat "
cn1940-01-17.txt,1940-01-17,negro or negroes,16,"FIRST: ecided . about ‘the middle of November.-that.their col- lege should offer special scholar- ships to Negro girls with a high academic standing.  Mrs. Norris in her letter to the Vasstr Miscellany News 
LAST:  mule over the man- tel, and, also among the black and white group, a study, brilliantly don2, of a negro woman’s head in four. different positions. Some of the oils, however, are very strange, partic "
cn1940-02-14.txt,1940-02-14,negro or negroes,2,"FIRST: t the Ben- jamin Franklin High School in New York, spoke, of the relation of  maids’ classes’ tothe negro prob-|  lem. She praised this work as being ‘a step ‘in the direction of breaking down the men
LAST: this work as being ‘a step ‘in the direction of breaking down the mental patterns concern-  ing the negro.  _ Dr. Kraus, of the Department of Social Economy, discussed with the commission on refugee w "
cn1940-02-28.txt,1940-02-28,negro or negroes,1,"League conference and afterwards sent us a package of about twelve books and many pamphlets for our Negro Problems and French classes. °  We need books of all kinds: the standard classics; atlases, di"
cn1940-03-06.txt,1940-03-06,negro or negroes,2,"FIRST: mpton Quartet from Hampton Institute presented a program of    two brief speeches on folk-songs and Negro education by the direc- tor, Frederick Grinnell.  The first group of songs in- cluded the fami
LAST: John Wainwright, will be glad to hear that he now has charge of a deck on the Hudson River Line,    Negro spirituals, interspersed with| ing refrain. As usual, the singers’| piece on the program: Juba "
cn1940-04-24.txt,1940-04-24,negro or negroes,4,"FIRST: of pleasant farm coun-  »  Reformatory and  a  ‘Budding Sociologists ‘tase. With Interest  Cheyney: Negro College    By Agnes Mason, °42 Last Wednesday the first year Sociology class and a few Sub- je
LAST: d us that Cheyney was started about 100 years ago by a group of Quakers. Originally they took a few negro boys and put them to work on a farm, giving them a, small amount of schooling. The attempt was "
cn1940-05-15.txt,1940-05-15,negro or negroes,2,"FIRST:  Anna Kearney, with Jeannette Holland as mistress of ceremonies.  The whole group of maids sang the negro national anthem, Lift Every Voice and Sing, and a spir- itual, Every Time I Feel The Spir- it,
LAST: ed on the Radnor carpet, with eyes fixed dreamily on their makeshift bon- fire, the grads then sang negro spirituals. The last advice called after us as we left. this den of in- tellect was, “Never tr "
cn1940-11-05.txt,1940-11-05,negro or negroes,1,"n Octo- ber 25. The Wharton Settlement House where the work is to take place is in the heart of the negro district of Philadelphia, and most of the work will be allotted to cleaning up slums in this n"
cn1940-11-13.txt,1940-11-13,negro or negroes,1,"d engaged in some political activity such as helping to unionize college employees, protesting anti-negro discrimination, organizing peace activities, or working with the American Student Union.  The"
cn1940-11-20.txt,1940-11-20,negro or negroes,1,matizing extra-legal. dis- franchisement in the South: the shadow of the Klan broke up a meeting of negroes and —-poor whites. The-effect was achieved by a lighting technique.  The key scene of the pl
cn1940-11-27.txt,1940-11-27,negro or negroes,1,"s in all the other pieces, her surenéss of tone was impeccable.  The program was concluded with two Negro Spirituals and three short songs. In Deep River the ar- tist again attained subtle contrast of"
cn1940-12-18.txt,1940-12-18,negro or negroes,1,"this country. The delegates represented a cross-section of Philadelphia youth, including members of Negro Youth Organizations, the C. I. O. and the A. F> of L., as well as many stu- dents from high sc"
cn1941-02-12.txt,1941-02-12,negro or negroes,3,"FIRST: s  now surrounded; guns encircled them.    Continued from Page One  The beach stretching north from Negro Youth Congress; Labor’s Dunkerque was “a maze of destruc-| Non-Partisan League; and Young tion
LAST: ansport, and a hundred smaller a , vessels were. lying wailen Beyond norities; for the extension of Negro the shore, but no Reval Navy ships suffrage; and protection of labor’s ’ rights. vot on ga cay "
cn1941-02-19.txt,1941-02-19,negro or negroes,2,"FIRST: he Music Room of Goodhart on Sun- day evening, February 22, at 7.30. Dr. Thurman is a distinguished Negro minister, who has been one of the outstanding leaders at the Northfield summer _ conferences. 
LAST: great enthusiasm in | their twenty classes: musical lan- guages, typing, poetry, mathe- matics, and Negro history, a class , of 40. Haverford’s classes for jani- | tors have branched into students’) w "
cn1941-04-16.txt,1941-04-16,negro or negroes,9,"FIRST: doll dis- played in the Bookshop. Chances may be charged.            NYA Work Programs  Enroll More Negroes      Aubrey Williams, National Youth Administrator, announced  that Negro youth has increase
LAST: e quartet has several special songs, and the accompaniment for the play will be provided by an able negro orchestra from North Philadelphia, consisting of a piano, guitar, bass, drums, trumpet and a v "
cn1941-04-23.txt,1941-04-23,negro or negroes,1,"co RE  ee ee  ee  To i. As —  wm  of negro jazz Spontaneous SONS  THE COLLEGE NEWS  Z-615      VOL. XXVII, No. 21  BRYN MAWR and WAYNE, P"
cn1941-05-01.txt,1941-05-01,negro or negroes,13,"FIRST: und that the actual practices of the Philadelphia. Hous- ing Authority spell discrimination against Negroes. The Philadel- phia Housing Authority seems to reason this way. The Glenwood Project of five
LAST: gro race has made to American music. We are also proud to present over the air one of the many fine Negro thusical groups which have been de- veloped by the N. Y. A.”  The N. Y. A. Philadelphia Chorus "
cn1941-06-04.txt,1941-06-04,negro or negroes,1,"job. The. choruses were good, and the music | was hot and heavy with rhythm, | completely suited to negro voices | and jam dancing.  The. setting and.costumeswere | modern and natural, though the | re"
cn1941-10-08.txt,1941-10-08,negro or negroes,1,"res, Juniors, and Seniors are eligible. Subjects to be offered include current évents, mathematics, negro history, hygiene, music, mod- ern languages, typing, short- hand, knitting, ete. The lists wil"
cn1941-10-29.txt,1941-10-29,negro or negroes,1,"taking a larger part in the classes than ever before. Adelaide Cromwell, Smith, ’40, who will lead Negro History discussions, has written her mas- ter’s thesis on that subject.  Typing, Piano Lessons"
cn1942-02-11.txt,1942-02-11,negro or negroes,9,"FIRST: lights which bobbed obedi-  ||. Music Room, 7:30.      Recital to be Given By Dorothy Maynor, Great Negro Singer    The young negro soprano, Dor- othy Maynor, will give a recital in Goodhart Hall, Mon
LAST: ll as a political settlement.    Center, the Main Line Singers, finished off the meeting with a few negro spirituals. Afterwards, over hot cocoa, plans for the next year were discussed by the voting m "
cn1942-02-18.txt,1942-02-18,negro or negroes,1,ed  By Barnes Stormers    Continued fronf Page One clusive school into a cultural insti- tution for negroes.  This brought forth a storm of rage from conservative Merion but  the building permits’ wer
cn1942-03-04.txt,1942-03-04,negro or negroes,1,"ss Harriet Young, presented the first part of a ballet. The dance was symbolic of early non-western negro-culture. It was ritualistic, the action un- selfconscious and_ well-patterned, progressing fro"
cn1942-04-22.txt,1942-04-22,negro or negroes,1,"hension of her divine mission. with a special talent for singing| Madame Pitoéff movingly read pas- Negro spirituals. Their” versions|Sages dealing with the horrors of of the old favorites, Golden Sli"
cn1942-05-01.txt,1942-05-01,negro or negroes,5,"FIRST: t war plants in the Philadelphia area. :  The Sun Shipbuilding and Dry- dock Company announced that Negro workers, formerly given only menial jobs, would be offered skilled mechaniestraining. Last wee
LAST: ite being one year of labor- atory science. The Bryn Mawr School is unique in admitting qual- ified negro college graduates.  The courses will include anato- my and physiology, chemistry, mi- crobiolo "
cn1942-10-29.txt,1942-10-29,negro or negroes,2,"FIRST:  French, and Spanish.  Other courses cover a variety of fields: Current Events and Speech Training, Negro History, German, Typing, Shorthand, Sew- ing, Piano Lessons, Music Appre- ciation, Folk Dancin
LAST: arie Lee and Mary Ellis; Span- ish by Barbara Baer and Jackie Simon; Current Events by Boots Szold; Negro History by Niles Rumely;) German by Mary Vir- ginia More; Typing and _ Short- hand by Pearl Ed "
cn1942-11-04.txt,1942-11-04,negro or negroes,2,"FIRST: ss characterizes this year’s college newspapers. A- forceful editorial calling for the admission of Negroes to its undergraduate ibody places The Princetonian well in the lead. The campaign prompt- ly
LAST: campus. Forums on India, a_ service flag ceremony, combined - war relief drives, : dis- cussions on Negro morale, and vig- orous editorials are some of the high spots. Characteristic of the prevailing "
cn1942-11-11.txt,1942-11-11,negro or negroes,4,"FIRST: up    Continued from Page One  | order to preserve wage standards |  won in the past.  Thousands of Negro women an- xious to work are unable to find | jobs. Employers are able to evade  | the Fair Emp
LAST:  labor for the  pose more  edly true that a larger proportion | SPtng and summer plowings. If  | of Negro women are inexperienced | enough j in industry than white women, due | practices. | = | The po "
cn1942-11-18.txt,1942-11-18,negro or negroes,1,"from post-Civil War days in eight southern states. In these states a large minority, including many negroes, is, in effect, deprived of the right to vote by the poll tax law. The bill to abolish. the"
cn1943-02-10.txt,1943-02-10,negro or negroes,2,"FIRST: nterested students met on Monday night to form a committee for the creation of a mixed army unit of Negroes and white men on a voluntary basis. There were representatives from Bryn Mawr, Pennsylvania 
LAST: d that it would be a step for- ward for the freedom for which we are fighting if the segregation of Negro and white soldiers was abolished. Such segregation causes disunity and hinders the war ef- for "
cn1943-02-24.txt,1943-02-24,negro or negroes,2,"FIRST: r lack. by the Hampton Singers seems to| to described the latest experi- be something found only in negro| ents made in that field on ani- spirituals and is less sharply de- |), and people. Many condi
LAST: Mrs. Stowe is comforting her little boy, Freddie, after the scare of a “Ken- tuck” raid on the free Negro dis- trict near their home, she sudden- ly turns to those around her and remarks on the sad co "
cn1943-04-14.txt,1943-04-14,negro or negroes,7,"FIRST: of social and economic pov- erty has been such as™would tead the average citizen to look upon all  ‘Negroes whom they pass in the  street as “muggers.” The practice  Junior Prom  The Junior Prom, to b
LAST: s.  This is the kind of thing that our Japanese enemy makes good use of in its propaganda among our Negro citizens to the effect that “Japan is the defender of the darker races.” This is the kind of t "
cn1943-04-21.txt,1943-04-21,negro or negroes,2,"FIRST:  now takes on the character of a war measure. The darker races of the world, including the American Negroes, cannot be blamed for listening to our democratic win-the-war slogans with a bit of skeptici
LAST: id that the | manpower shortage was much ex- | aggerated, in view of the failure | to use the great Negro labor sup- | ply in the best way possible. She urged the restoration of the Fair | Employment  "
cn1943-05-01.txt,1943-05-01,negro or negroes,9,"FIRST: the students who do attend classes. A STUDENT.        seem fair.    Four Colleges Debate Problem of Negroes    Villanova College, April 29.— Education of both the majority whites and the minority Negr
LAST: e the work of abolishing dis- crimination in industry, he said, and unions must cease limitation of Negro membership. Public    during long summer vaca-.          opifitor, he stated, is an important  "
cn1943-06-08.txt,1943-06-08,negro or negroes,1,orado 1928 and M.A. 1930. Dissertation: The Cultural Adjustment of a Minority Group: A Study of the Negroes of Philadelphia.  Presented by Professor Mildred Fairchild    The announcement of the award
cn1943-10-07.txt,1943-10-07,negro or negroes,9,"FIRST: work and thus impeding the success of the entire war  effort. The Red Cross accepts blood from both Negro ‘and |  white donors. The Red Cross puts this blood in separate banks. The blood from the bank
LAST: ry | one who is well aware.of,Nazi race theories will try to find  | comfort in the belief that the Negroes, too, will emphatically  reject this pernicious propaganda. The best weapon against this ene "
cn1943-10-14.txt,1943-10-14,negro or negroes,1,nter-balancing one.  As for the charge that its “Sketches in Black and White” are fostering an anti-Negro feeling —the obvious answer is that the writer“has neglected the other humor de- partments. Ev
cn1943-10-21.txt,1943-10-21,negro or negroes,2,"FIRST:  may do so at the || cost of approximately one dol- lar. \\              Ae  IRC to Open Season With Negro Problem As Topic for Debate  Political prospects on the Bryn Mawr campus are looking up. There
LAST: coming year.  The first issue for discussion, slated for the latter part of next week, will be “The Negro Citizen in-~Wartime.” From Haverford we hope to borrow Masamori Ko- jima, who has made exhaust "
cn1943-11-03.txt,1943-11-03,negro or negroes,3,"FIRST:  certain to pass. Even the southern Senators, who in the past op- posed those sections safeguarding Negro schools, now threw their support to the bill. Most of the opposition stemmed from the same old
LAST:  without consider- ing its consequences.. Thirdly, this illustrates ‘how our fail- ure to solve the Negro question is manipulated by reaction- aries to retard the progress of the entire nation. Lastly "
cn1943-11-10.txt,1943-11-10,negro or negroes,12,"FIRST: ey have been raised to hold such a belief. There is discrimination here against a group such as the Negroes, while in anpther country con- sciously drawn against them,  National Policy “We should make
LAST: ite per-  stom, gettem Sot eae cas | : . TO ADV ANT AGE == fume go farther. Select your             Negro soldier in trouble, Also she                     Haverford’s’ military and civilian EVEN SANTA "
cn1943-11-17.txt,1943-11-17,negro or negroes,2,"FIRST: trips”, which will include a con- cert and a» French movie. She would also like to start a class in Negro history, to be taught by a Negro graduate student.  The courses include a Current Events class
LAST:  cert and a» French movie. She would also like to start a class in Negro history, to be taught by a Negro graduate student.  The courses include a Current Events class taught by Betty Ann Orlov, a Lat "
cn1944-01-12.txt,1944-01-12,negro or negroes,4,"FIRST: ation Army. Keep paper circulating. Help win the war sooner.  is a severe        Granger to Discuss Negro Race Conflict  ' The Philadelphia chapter of the American Association of Social Workers will p
LAST: s been es- tablished to make investigations among Negroes in cities, to pro- mote social work among Negroes until other agencies extend their programs to include them.              Haverford, Pa. Ardm "
cn1944-01-19.txt,1944-01-19,negro or negroes,3,"FIRST: ing the war and have resulted in new demands of minority groups.  Migration —.__-_-_—  Migration of Negroes from ru- ral to urban districts and from Southern to Northern cities has been taking place s
LAST: denied democracy. ~An American towns and cities, the Urban League Executive Sec- retary stated, the Negro popula- tion is a good barometer of the conditions existing in the gener-    2l- community.  t "
cn1944-02-23.txt,1944-02-23,negro or negroes,1,"rge of the arrangements for refreshments, publicity, and tickets, and has contracted the well-known negro orchestra which has played often at the University of Pennsylvania.  Open only to the present"
cn1944-03-08.txt,1944-03-08,negro or negroes,2,"FIRST: Objected to by Representative Andrew J. May of Ken- tucky on the grounds that it describes northern Negroes as the equals in intelligence of southern white men and as such “it has no place in the Army
LAST: rences. Representa- tive May objected violently to a survey which he said show- ed that the average Negro in New York, Massachusetts, and Connecticut ranked on an intellectual level with the average w "
cn1944-04-12.txt,1944-04-12,negro or negroes,2,"FIRST: And the Booker T. Washington has lived up to its name. It is a daring and. success- ful experiment. Negroes, Philip- pines, Caucasions and Orientals have proved on it that they can cooperate for the b
LAST: troduced into the legislature, following an _in- vestigation of industrial discrimin- ation against Negros.      WHAV-WBMC  (640 kilocycles) Wednesday ,April 12 , 8:30 Classical Hour H 9:30 Le Jazz Ho "
cn1944-05-10.txt,1944-05-10,negro or negroes,1,"one such box, a box which may bring hope and comfort to an Amer- ican soldier.        shadings of a Negro spiritual,          Come to the INN in lilac time, In lilac time, in lilac time; Come to the I"
cn1944-05-17.txt,1944-05-17,negro or negroes,2,"FIRST:  vote of “no closure.”  The poll tax is not a race ques- tion; as a matter of fact more whites than negroes are disen- franchised by it. Nor does it in- volve the issue of states’ rights, for “only fe
LAST: es, taught by undergraduates at the request of~ various groups. The most popular of the courses are Negro History and _ Current Events, with an enrollment of nine each. Chemistry, English, Public Spea "
cn1944-10-04.txt,1944-10-04,negro or negroes,1,"untry, she remembers, the day before the World’s Fair closed. She knew no English, had never seen a Negro, and never in her wildest dreams had imagined anything quite like the Wrigley sign on Times Sq"
cn1944-10-18.txt,1944-10-18,negro or negroes,1,"g and appreciation, with an hour’s time per week: de- voted to each.  The largest enrollment is for Negro history, with nineteen pros- pective students. Pat Acheson ’46, will start the class, and arie"
cn1944-11-01.txt,1944-11-01,negro or negroes,2,"FIRST: directed legislative investiga- tions for. the states of New York and New Jersey. 5  Mr. Granger, a negro, is a na- tive of Virginia and was educat- ed in the public schools of New- ark, New Jersey, a
LAST:  and labor, and between intellectuals and non-intellectuals.  Miss Taylor discussed primar- ily the Negro problem. She drew some of her material from a re- cent publication, An American Dilemma, by Gu "
cn1944-11-08.txt,1944-11-08,negro or negroes,4,"FIRST:  even more serious difficulties will de- velop if nothing is done to check the hatred of whites for negroes and the suspicion of negroes to- ward whites.  Negro Veterans  Our dealings with negro veter
LAST: whites for negroes and the suspicion of negroes to- ward whites.  Negro Veterans  Our dealings with negro veter- ans will be crucial. The question is whether they shall be shunted back into Jim Crow j "
cn1944-12-06.txt,1944-12-06,negro or negroes,1,"lan Annual Caroling    A choir of maids and porters will serenade the campus with Christmas carols, negro spirituals and old favorites on request, Mon- day night, December llth. Al Mackey of Merion, L"
cn1945-02-14.txt,1945-02-14,negro or negroes,5,"FIRST: hat the editorial in the William and Mary College paper demanding complete equality for whites  and negroes in the college should have been expressed in such a “sensational” manner, for it is a proble
LAST: ular academic situation should not obscure its larger significance. versities and colleges do admit negroes to their student body, with varying degrees of success. The difficulty is not so much one of "
cn1945-04-11.txt,1945-04-11,negro or negroes,1,"lous cred- itors of their lovely young owners (feminine), and with equal eager- ness saves a worthy Negro from  a Voodoo death. Continued on Page 3  Politics and Sociology The Academy of Political and"
cn1945-04-18.txt,1945-04-18,negro or negroes,4,"FIRST: on. —      They | |  Fine Leather Picture ;  +} Summer— Sessions start:  | {| Richard Stockton |    Negro Problem in South Realistically Depicted By Wright  by Louise Gorham 47 The Negro problem in th
LAST: uld serve to make’ his story of great interest, but this is increased by his clear insight into the Negroes as per- sons. He realized their faults and held them to be the cause of their present’ situa "
