filename,date,keyword,count,context
cn1915-04-29.txt,1915-04-29,negro or negroes,1,s?  MR. TAFT SPEAKS AT HAMPTON  April 23d was the 47th anniversary of the Hampton Institute for the Negroes and Indians of the United States. Hun- dreds of people from different parts of the country a
cn1916-10-11.txt,1916-10-11,negro or negroes,2,"FIRST: ntinuous mental activity nor even any continuous power of organized gov- ernment. Such are the pure negroes of Africa, the Indians, the Esquimaux, the South Sea Islanders, the Turks, etc. own semi-civ
LAST: a, the Indians, the Esquimaux, the South Sea Islanders, the Turks, etc. own semi-civilized American negroes have shown in Haiti what they revert to when left to themselves. + * * * + +  “These facts m "
cn1917-10-10.txt,1917-10-10,negro or negroes,1,"its work on account of the war. Miss Cheatham has done a great deal of re- search in American and’ negro folk- songs. She also sings French, Russian, and German folk-songs. Miss Cheatham has been rec"
cn1918-05-09.txt,1918-05-09,negro or negroes,2,"FIRST: ed Theology, Chicago University. Wednesday, May 15  7.30 p. m.—Address by Mr. Leslie Hill |  on the negro problem. Friday, May 17 8.00 p. m.—Minstrel Show in the gym- sium by 1920. .For the benefit of
LAST:  Beta Kappa man and class orator. He went through college on scholarships.  His subject will be the negro problem in this country.  NEWS IN BRIEF The secretary and treasurer of the War Council will be "
cn1918-05-23.txt,1918-05-23,negro or negroes,5,"FIRST: hours below merit the Senate will consider each case separately and en-  COLORED EDUCATOR SPEAKS ON NEGRO PROBLEM    The negro problem in the United States w23 defined by Mr. Leslie P. Hill, head cf t
LAST: ce to live in phys- ical decency, and recognition that its worst types are not representative.  The negroes have earned the right to greater consideration than they have had, Mr. Hill affirmed. An inv "
cn1919-01-09.txt,1919-01-09,negro or negroes,1,"irl. If you want to see me again you gotta turn round.’”  Another of Major Davis's stories was of a negro who, when sent out to get a German prisoner, returned without his man. “I had one,” he explain"
cn1919-03-05.txt,1919-03-05,negro or negroes,3,"FIRST:  “The Grasshopper,” and “The Lion in India” (as an encore) were read at the close.  Has Studied the Negro  “The Congo,” a long poem which gives its name to one of Mr. Lindsay’s volumes, he described a
LAST: ous study of the negro, his savagery, his hope of religion and his irrepressible high spirits. “The negro has a religious rather than poetic genius in his singing,” said Mr. Lindsay, “and his religion "
cn1919-03-26.txt,1919-03-26,negro or negroes,7,"FIRST: s the|get. information about their respective]. . the distrust and hatred in the] BETTER CHANCE FOR NEGROES. result of a competition which began after |< shurehes. For instance, Dr. Mutch i ee ee midy
LAST: mes not worth adding to the college ‘col- {lection will be sent to the community cen-| ,|ter and to negro’ schools in the South.  Those volumes not worth preserving at all will go to the Junk Committe "
cn1919-04-09.txt,1919-04-09,negro or negroes,1,"t, the spirit  “during the offensive of last  “Americanization does not mean teach-  whites and the negroes and to the border  Day. “In every city there are great sec- tions of foreigners absolutely c"
cn1919-05-07.txt,1919-05-07,negro or negroes,5,"FIRST: s Visit Cheyney: School for Colored Teachers.  Eleven undergraduates visited the Cheyney School for negro teachers last Saturday. The negro students cooked and served lunch in the model dining room. A
LAST: evelop PRI Announcements  a own satige 8 og abilities. We Booklets, etc.  should give the Poles and negroes and  Italians in the country a chance to ex-| 1011 Lancaster Ave. Bryn Mawr, Pa.  press some "
cn1919-10-14.txt,1919-10-14,negro or negroes,1,"rse also includes Miss Eva Whiting White, head of the New York College Settlement; James Johnson, a negro poet, and several other well-known people.  Programs of the course will be dis- tributed Wedne"
cn1919-11-19.txt,1919-11-19,negro or negroes,2,"FIRST: s. Required gymnastic classes begin. Wednesday, December 3 7.30 p. m.—Lecture on “The Future of the Negro,” by Mr. James Johnson, of the National Association for the Ad- vancement of the Negro. Saturd
LAST: uture of the Negro,” by Mr. James Johnson, of the National Association for the Ad- vancement of the Negro. Saturday, December 6 10.00 a. m.—Varsity Hockey vs. Philadelphia. 8.00 p. m.—Graduate Play fo "
cn1919-11-25.txt,1919-11-25,negro or negroes,6,"FIRST: on, Thursday evening, and spoke to them on graduate work in English universities.    “FUTURE OF THE NEGRO” SUBJECT OF SOCIAL SERVICE LECTURE James Welden Johnson will speak on “The Future of the Negro
LAST: ture of  the Negro,” by Mr. James Johnson,  of the National Association for the  Advancement of the Negro.  Saturday, December 6  10 a. m—Varsity Hockey vs. All Phila-  delphia.  8.00 p. m.—Graduate P "
cn1919-12-10.txt,1919-12-10,negro or negroes,4,"FIRST: ope loswpatienee with a country whose Sen- ate! is: so recalcitrant. Children starve in Serbia. The negro problem. remains: unsolved. - And above it all, Morpheus grins satirically    LETTERS TO THE E
LAST: m may be found,” gaid Mr. Johnsen. “In some sec- tions of the country there is talk of treating the negro in ratio to his useful- ness. This is a misguided point of view. The negra myst be logked on a "
cn1919-12-10.txt,1919-12-10,negra,1,is talk of treating the negro in ratio to his useful- ness. This is a misguided point of view. The negra myst be logked on ag a hur man being with the papirations and gor- rows of a hymay being. It i
cn1920-01-15.txt,1920-01-15,negro or negroes,1,"de Montoliu, . accompanist) a.) Freebooter’s Cradle Song... Wallace o) \ Know Amin... Whelpely c.) Negro Spirituals I’Tis Me, Oh Lord. II.Didn’t It Rain? ........ Burleigh                     Vol. VI"
cn1920-01-21.txt,1920-01-21,negro or negroes,2,"FIRST:  Noah Swayne, a soloist of the Orpheus Club, who has a baritone voice af wide range and purity. His Negro Spirituals, including the old favorite, ""Tis Me, Oh Lord, were most popular Kreisler’s Cradle 
LAST: . Ray- mond Robins; British Labor Party, by Mr. Paul Kellogg, Editor of the Sur- vey; Future of the Negro, by Mr, James Johnson, of the National Asso- ‘ciation for the Advancement of the Ne- gro; Paro "
cn1920-02-11.txt,1920-02-11,negro or negroes,1,"And | up and down was always surging a} crowd, handsomely dressed Fasi, offi- | cials or merchants, negroes driving heav ily laden donkeys who could more easily | pass under the over-hanging caves tha"
cn1920-02-11.txt,1920-02-11,negress,1,"ast. The marriage contracts contain many elaborate regulations, often stip- | ulating the number of negresses the bride | may employ, and even the number of visits she may receive from her own mo  air"
cn1920-02-26.txt,1920-02-26,negro or negroes,2,"FIRST:  the advancement of the Colored Race. Miss Ovington set forth present- day issues that confront the negro race and presented the work of prominent colored men and women to an audience of 55 of the 68 
LAST: ence of 55 of the 68 maids in college.  Miss Ovington, who is at work upon a novel dealing with the negro question, led an informal discussion after the lec- ture.  Hereafter, current event classes fo "
cn1920-03-30.txt,1920-03-30,negro or negroes,3,"FIRST: cial Service Committee.  Sunday, April |1.    | CHEYNEY es HERE APRIL 10°  —_  Represent School for Negro Teachers  cert at Bryn Mawr April 10, in Taylor Hall, at 8 o’clock, under the auspices of the 
LAST: inciple that “spiritual singing” is a gift peculiar to the negro and must not be lost by the modern negro.  Bryn Mawr is one of the few places where the students are allowed to sing away from their sc "
cn1920-04-14.txt,1920-04-14,negro or negroes,3,"FIRST: oover has been an able collaborator. She was of active as- sistance in Belgian relief work.      a ‘negro “compose. is,    1917.  | |    mittee.  “Speak up, Ike, 'spress you'self,” a hu- morous monolo
LAST: ens for alumnae and former students to share their rooms for these nights.  with seellathdiea ‘in| “negro dialect were included in the pro- gram given by the Cheyney Singers in ‘Taylor Hall, Saturday  "
cn1920-10-13.txt,1920-10-13,negro or negroes,3,"FIRST: n as last year. The curriculum will include reading, writing, arithmetic, typewriting, the study of negro writers, negro history, and cur- rent events, with a course on citizenship and voting. The cou
LAST: November 16th.  Monthly magazines will be taken, in- cluding “Current Events” and “The Crisis,” the negro review, in all the halls.  Among the other plans the committee hopes to organize a club among  "
cn1920-10-20.txt,1920-10-20,negro or negroes,1,"Six Subjects in Night School — Miss Mary E. Moore, the founder of the Farm Life School for Mountain Negroes at Hiddinite, N. C., spoke about her work to the maids of the college at a meeting last Sund"
cn1920-11-23.txt,1920-11-23,negro or negroes,1,"f woolen garments to Doctor Gren- fell. At the same time four large boxes were sent to the southern negro settlements,    Office Notice Students are asked to read carefully the train schedules posted"
cn1920-12-15.txt,1920-12-15,negro or negroes,1,"Philadelphia. The stockings being filled will be sent to the Kensington Light- house Settlement, to negro schools in the South and tothe Spring Street Set- tlement in New York. Special stockings are b"
cn1921-02-16.txt,1921-02-16,negro or negroes,1,"white woman in’ the «school. for fifteen years, will speak on the subject of “Education Among’ the Negroes.”  The Vocational Conference will be held the week-end after. Easter.  E. Vincent, ’23, has"
cn1921-02-23.txt,1921-02-23,negro or negroes,2,"FIRST: of the women who has done most for delinquent girls in New York. scsi eae oen  WORK WITH SOUTHERN . NEGROES DESCRIBED BY MISS SOOLEY ""| -Miss-Rossa_ Cooley, | Negroes, Carolina, ‘was the guest of hono
LAST: York. scsi eae oen  WORK WITH SOUTHERN . NEGROES DESCRIBED BY MISS SOOLEY ""| -Miss-Rossa_ Cooley, | Negroes, Carolina, ‘was the guest of honor. at an informal tea given’ by the World Citi-     “Tzensh "
cn1923-03-07.txt,1923-03-07,negro or negroes,1,"lf in some form. .  The foreign races here were brought by us, Dr. Steiner went on. We imported the negro when slaves were needed and the Indian would not serve his conquerors. The peoples of southern"
cn1923-03-14.txt,1923-03-14,negro or negroes,1,"e had _ enthusiastically  jattempted to sing parts of Brahm’s “Requiem,” they played again, a short negro melody arranged by Coleridge  Taylor. — f “The ‘Frio wilt come again- next wis! when Brahms’ “"
cn1923-10-24.txt,1923-10-24,negro or negroes,4,"FIRST: r, we come to thee to make sacri- fice in thy honor. CONTINUED ON PAGE 3  HAMPTON QUARTET SINGS OLD NEGRO! MELODIES    Dr. Gregg Explains the History and Needs of Institute    Speeches about Hampton I
LAST: ment of over 2000 students, ayith more than. 150 buildings and over a thousand-acres of land. , The negro melodies and other selections which followed were sung by the quartet  unaccompanied. All subs "
cn1923-11-07.txt,1923-11-07,negro or negroes,17,"FIRST:  &  PRESIDENT-EMERITUS THOMAS, WHO RETURNED TO THE DEANERY TODAY      DR. PINCKNEY HILL DISCUSSES . NEGRO PROBLEM IN AMERICA    History of Negro a Struggle Against Great Obstacles    »  The negro prob
LAST:  the last incidence .no race will admit itself of degraded blood. Social equality asked. for by the negro means that he shall- have the same treat- ment as any law-abiding person.    FIRST TEAM TENNIS "
cn1924-01-16.txt,1924-01-16,negro or negroes,4,"FIRST: e summed up in.a big meeting by ‘four stu- dent speakers, one from the South, one from the North, a Negro, and a Filippino.  The Southerner emphasized justice, and said that few in the South believe i
LAST: fair chance. Culture*is possible only through contact. If we refuse the chance of con- tact’ to the Negro #t-is unfair to expect him to accept our standards.  A_ few specific proposals were made— that "
cn1924-02-27.txt,1924-02-27,negro or negroes,2,"FIRST:  the colored girls are finding that some of the white girls have come together and decided that the negro  race is inferior, more immoral than the white race, and that th@y are unwilling to treat the 
LAST: negro  race is inferior, more immoral than the white race, and that th@y are unwilling to treat the negro students on the same basis as they would each other. It would seem that these girls are thus d "
cn1924-03-12.txt,1924-03-12,negro or negroes,1,"e ee eee es .. 25.25  YOUTH ORGANIZATIONS ATTEND CONFERENCE  CONTINUED FROM PAGE 1  colleges, Jews, negroes, preachers, doctors and labor organizers came into intellec- tual contact. In those two days"
cn1924-04-09.txt,1924-04-09,negro or negroes,7,"FIRST: tisfactory record in the School and their  CONTINUED ON PAGE 5  CONFERENCE AT SWARTHMORE TO DISCUSS NEGRO PROBLEM    Amalgamation or Segregation to Be Discussed as Possible Solution    An Inter-racial
LAST:  Negro Race”; “The Problem of Race Superior- ity’; “The Economic, Social, Educational Status of the Negro in the United States”; or “Biological Differences.” In addition each delegate has been asked   "
cn1924-04-16.txt,1924-04-16,negro or negroes,10,"FIRST:   DISCUSSED AT SWARTHMORE  Opportunities in Educational and Economic Matters Essentially  Needed by Negro '  BRYN MAWR SENDS DELEGATES      Colored and white delegates met to dis- cuss interracial pro
LAST: l.fields of life, but especially in education. Present preju- dice can never be overcome unless the negro is giyen the opportunity of self-  -meet to discuss common problems of na- tional and internat "
cn1924-04-30.txt,1924-04-30,negra,1,nestly hunted. for-and-honestly looked at. -For a* good many people there the experience of meeting negraes as thinking being to think- ing being was new. We learned at first’ hand something of that o
cn1924-04-30.txt,1924-04-30,negress,1,"Book reviews on Rose Macaulay’s Told By An Idiot and There is Confusion, a first novel by the young negress, Jessie Richmond Fauset, and two poems by Pamela Coyne, ’24, complete the issue. VESPERS LED"
cn1924-05-07.txt,1924-05-07,negro or negroes,1,"tradition, as at that ie * div HRA ’ Class.”*  Bite Breeches... 2... 6.65... P. Dodge, ’27 time all negroes were Moors to English-  Pepper Breeches,.....:..J. Schoonover,’25}men. > : : fe : ; Mr. Alls"
cn1925-02-18.txt,1925-02-18,negro or negroes,1,", or could be wholly done away with. But the basis of this nationality is not race but feeling. The Negro in peace has to struggle for common rights, but in war he’s a full-blooded American, sharing w"
cn1925-03-04.txt,1925-03-04,negro or negroes,1,"ns will be held in the Academy of Music at-4 P M., Sun- day, March 8. The Hampton Quartet will sing Negro spirituals. Dr. Robert R. Mo- ton, principal of Tuskegee Institute, and Dr. James E. Gregg, pr"
cn1925-03-11.txt,1925-03-11,negro or negroes,1,"as to objects.” There are reflections of archaic Greek sculpture, Sienese, German and the African. Negro’s. Little wood, some bronze, a good deal were used. of simulated bronze and hardly any stone w"
cn1925-03-18.txt,1925-03-18,negro or negroes,8,"FIRST: s; but who will donate the leading ladies    . DEBIT OR CREDIT?  A great deal is being done for the negro these days. Philanthropists work hard, gentlemen interested give lectureS and | firite ‘letter
LAST:  independently, to American life. So is it not well to remember, in considering negro charities and negro reforms, that their side of the debt is in great sid already paid? -    (This letter was recei "
cn1925-04-15.txt,1925-04-15,negro or negroes,1,"ssible.  Miss Loraine Wyman, the the evening, will give a group of Ameri- can folk songs, including negro spirituals and Kentucky mountain songs.  Ta contrast to this a generous | *  soloist of}:  -|C"
cn1925-09-30.txt,1925-09-30,negro or negroes,1,"ncerto of Tschaikowsky.  Harold Samuel, the English interpre- ter of Bach, and Roland Hayes, famous Negro tenor, are also on the list of artists engaged for performances. Bela Bartok, Hungarian compos"
cn1925-10-21.txt,1925-10-21,negro or negroes,1,"1 was screaming, crying and kicking at the door trying to open it. Soon I noticed that  tion of the negroes, who were coming  t gate me_ to eat me.  by my’ screaming I attracted the Aitten-.  | photo."
cn1925-11-04.txt,1925-11-04,negro or negroes,1,"e Swedish ballet number last year, which interpreted the numbér called New York with a magenta clad negro strutting to a brass band, before mammoth sheets of morning papers ‘headlining Murder! Divorce"
cn1926-02-10.txt,1926-02-10,negro or negroes,9,"FIRST: f her investigation versions of a; song often garying with locality. She writes of the share of the Negroes of the South in preserving the ballads and traditional songs of the early Scotch and English
LAST: is and Louisville, and from Irish construction gangs on the Union Pacific Railrdad, Irish songs and negro songs with a mellow guitar accom- paniment,              '28, M. Hupfel ’28, S. Sturm ’26, A. ""]"
cn1926-12-08.txt,1926-12-08,negro or negroes,8,"FIRST:  boundaries do also for those ELEANOR Woottey. | who rightly belong to neither group, but  2 °e THE NEGRO PROBLEM Nigger Heaven, by Carl Van Vechten.  vital: problems before, America today: is the so-
LAST:  have a.good time |,  PROBLEMS OF PARENTHOOD  his characters at first-hand—from “Eyes,” the mammoth Negro dope fiend, to Jean. Maline, the scholarly forger, who gives Sammy lessons in rhetoric at Sing "
cn1926-12-15.txt,1926-12-15,negro or negroes,2,"FIRST: are twelve white families which, under the auspices of the local Y. M. C.A. are entertaining twelve negroes. This does not mean that the mothers in the families need worry about their daughters marryi
LAST: roes. This does not mean that the mothers in the families need worry about their daughters marrying negroes—there is a long step between human kindliness and intermarriage. It is merely a. fore- runne "
cn1927-01-12.txt,1927-01-12,negro or negroes,2,"FIRST: hristians interfere with the spread of Christianity.  The Race Question from the point of view of a Negro was discussed by Mordecai Johnston. “We want the stigma of inferiority removed from the  Is   
LAST:    |837 Lancaster Ave., Bryn Mawr  Inported Perfumes CANDY Sapa _ GIFTS    = Wigs Masks Make-Up. |  Negro, rcs said. “We want ‘oi take part in th@economic life which con-#.  cerris us; we want politic "
cn1927-01-19.txt,1927-01-19,negro or negroes,1,"ovakian immigrant, on the social problems that come to Ellis Island, and Eugene Kinkle Jones on the Negro migration to the North The lec- tures were for the most part illustrated by visits to institut"
cn1927-03-23.txt,1927-03-23,negro or negroes,3,"FIRST: Long Branch will be as successful as all previous ones.    IN OTHER COLLEGES .    Query. wr Could a Negro girl be happy at Elmira College? What do you think about it? Would you not like to think that 
LAST: n. There is no college in the United States~solely for the Negro woman student, as there is for the Negro man student.. Any student—anyone with the,desire for higher learning should not. be deprived o "
cn1927-05-04.txt,1927-05-04,negro or negroes,1,"neering feat is truly intriguing, and tales of daring aviafors, undaunted trap- pers of the swamps, Negro labor- ers of the old plantations and Red Cross workers of miracles are          >      ~"
cn1927-10-26.txt,1927-10-26,negro or negroes,4,"FIRST:  Talk and.found it:  caw CONTINUED ON PAGE 4  taitied’; that vivid court that has’ seén  ‘naw these,negro lodgers; the wild“island  rfinely preserved that same division be-  comes as a friend. . We fe
LAST: g.      record as a ‘inedical student, is’ one of  increased salaries, partly by means of |the best negro doctors in New York. funds raised by alumnae and a few gen- erous outside friends and foundati "
cn1927-12-14.txt,1927-12-14,negro or negroes,1,"String Quartet (mem- bers of Philadelphia Orchestra) will play Dvorak’s Quartet in F major, Op. 96 (Negro Quartet), Andante Cantabile (Tschaikowsky), and Can- zonetta (Mendelssohn).    Orchestra Progr"
cn1927-12-20.txt,1927-12-20,negro or negroes,2,"FIRST: f.”. Ovi&pational’ psychology is na longer Europea but almost purely Indian, combine with a strong’ Negro influence. “Modern America resembles a very. young man who hds accepted the religion of his fa
LAST: and variety of the program by an excellent render- ing of Dvorak’s String Quartet in F, Op. 96 (The Negro Quartet), and the Andante Cantabile from Tschaikowsky’s Quartet in D, Op. 11, bracketed with M "
cn1928-03-28.txt,1928-03-28,negro or negroes,1,"otluced Beseua: the tr that he should write what he knew about,  he wrote /  about a half civilized negro whd made. a futile attempt to run, a school for the people of his race. by the Provincetown pl"
cn1928-04-25.txt,1928-04-25,negro or negroes,2,"FIRST: e life of his community, indeed’ of hfs people. This is, something apparent in all literature about negroes and makes this novel more real,  Whereas Van Vechten showed usa portion of negro society of 
LAST: literature about negroes and makes this novel more real,  Whereas Van Vechten showed usa portion of negro society of » whose very existence we were ignorant, McKay has made real and human a group abou "
cn1928-05-02.txt,1928-05-02,negro or negroes,1,"elphia  Broad: In Abraham’s Bosom, the Pulitzer Prize play for 1927 by Paul Green. A vivid drama of negro life.  Walnut Street: A-.remarkable group of -players_in Galsworthy’s interesting play, Escape"
cn1928-05-09.txt,1928-05-09,negro or negroes,8,"FIRST:  Department, -Nda- tional Board of the Y. W. CG A. To most of us she better known as a} singer of . Negro -Spirituals than as a speaker. But her wide experienc with | both white and colored groups equ
LAST: teen hours. inton, D.C. ‘Prepared by Migs Ma- | $ie%, SOm., Vemor Buah Brows) sch ht bake shop, the Negro minister whose] NEW YORK: deira’s School, Washington, “D. C. : in LAW chief interest is the bu "
cn1928-05-16.txt,1928-05-16,negro or negroes,28,"FIRST:  self did not claim this: for him). But the question of intermarriage is not a paramount one to the negro of today, except as an aspect of whité prejudice and. timidity. Within his own race at this mo
LAST: on, as well as any other question of world interest? If we can make a place in this country for the negro to live as a human being among other human beings, we shall havé com- pletely freed him and ou "
cn1928-05-23.txt,1928-05-23,negro or negroes,8,"FIRST: -II,.—-Mr. Ketcham, ‘the leader of the: quartet, gave a brief sutimary of the develop- rment of the negro spiritual. - All the songs have not developed from songs of worship; some were songs of every 
LAST: s; during the slavery period, denied their. grand- What Hampton is attempting to do is to train the negro for com- munity needs, in order that he may go out and raise the moral and economic standards  "
cn1928-06-06.txt,1928-06-06,negro or negroes,1,"has been needed, alumnae and  The June issue of the Lantern: is- not, |    the asides spoken by the Negro girl, A    gets’ an over-emphasis as ‘well, in the pictures of the ludicrous in ,“Immagina- ti"
cn1928-10-17.txt,1928-10-17,negro or negroes,2,"FIRST: 17—B. M. vs. All-Philadelphia.  SECOND TEAM Oct. 27—Rosemont  ? —Bucgneer.  In 4943 jre-was-the——— \x0cnegro tunes and alexandrians, all are pressed    _- Book Review  dake Brown’s Body, by Stephen Vine 
LAST: e the sing- ing in the archway was deep, strong and completes a varied background of . folk- songs, Negro spirituals and random mel- odies, sung with an understanding that is developed through a hunge "
cn1928-11-21.txt,1928-11-21,negro or negroes,2,"FIRST: he sub- ject there will . bev. discussion of: -the origin and development of the Chinese, Japanese, Negro and East Indian races. Among those whom it hopes to secure for the discussions are Professor B
LAST: bert-centenary;--~ >    ‘dréssed .some meetings of a_ scientific character ; James Weldon ‘Johnson, Negro poet ‘and. secretary of the National’ Association for the Advancement of - ‘Colored People, re "
cn1929-02-13.txt,1929-02-13,negro or negroes,1,"or Shine. Chestnut: Good News is indomitable. Garrick: Black Birds, an entertaining and well-danced Negro. review. Lyric: And So to Bed, a delightful play about Samvel Pepys. ' Walnut: Kibitzer; a. “o"
cn1929-04-17.txt,1929-04-17,negro or negroes,1,".it. The’ fable can be traced’ back to 3500 B. C., and in India probably farther. The tales: of our negro population form an inter- esting analogy to this ancient-mate- rial. At Thebes an expedition i"
cn1929-04-24.txt,1929-04-24,negro or negroes,3,"FIRST: ill; conse- quently, there has beep 2 Femarkable development or tne~nattve musical _tal- ent of the negro students. The chap- lain, Rev. Lawrence Fenninger, was ‘very kind during the brief but strenu-
LAST: ar to the visitors. The chapel service at 7.30 P. M. was led by President Gregg. The singing of thé negro spirituals by the entire student body was an un- forgetable experience fit to cap a trip that  "
cn1929-05-01.txt,1929-05-01,negro or negroes,1,of pro- fessional. encouragement ?  During the war some American  officers found a way to make the negro troops work faster. » The troops: had—the~ habit of singing while they worked and keeping time
